tag,company,last_update,last_values
HAACU,Health Assurance Acquisition Corp. SAIL Securities,2000-01-01,0
HAACW,Health Assurance Acquisition Corp. Warrants,2000-01-01,0
HAFC,Hanmi Financial Corporation Common Stock,2000-01-01,0
HAIN,Hain Celestial Group Inc. (The) Common Stock,2000-01-01,0
HALL,Hallmark Financial Services Inc. Common Stock,2000-01-01,0
HALO,Halozyme Therapeutics Inc. Common Stock,2000-01-01,0
HAPP,Happiness Biotech Group Limited Ordinary Shares,2000-01-01,0
HARP,Harpoon Therapeutics Inc. Common Stock,2000-01-01,0
HAS,Hasbro Inc. Common Stock,2000-01-01,0
HAYN,Haynes International Inc. Common Stock,2000-01-01,0
HBAN,Huntington Bancshares Incorporated Common Stock,2000-01-01,0
HBANN,Huntington Bancshares Incorporated Depositary Shares each representing a 1/40th interest in a share of 5.875% Series C Non-Cumulative Perpetual Preferred Stock,2000-01-01,0
HBANO,Huntington Bancshares Incorporated Depositary Shares,2000-01-01,0
HBANP,Huntington Bancshares Incorporated Depositary Shares 4.500% Series H Non-Cumulative Perpetual Preferred Stock,2000-01-01,0
HBCP,Home Bancorp Inc. Common Stock,2000-01-01,0
HBIO,Harvard Bioscience Inc. Common Stock,2000-01-01,0
HBMD,Howard Bancorp Inc. Common Stock,2000-01-01,0
HBNC,Horizon Bancorp Inc. Common Stock,2000-01-01,0
HBP,Huttig Building Products Inc. Common Stock,2000-01-01,0
HBT,HBT Financial Inc. Common Stock,2000-01-01,0
HCAP,Harvest Capital Credit Corporation Common Stock,2000-01-01,0
HCAPZ,Harvest Capital Credit Corporation 6.125% Notes due 2022,2000-01-01,0
HCAQ,HealthCor Catalio Acquisition Corp. Class A Ordinary Shares,2000-01-01,0
HCAR,Healthcare Services Acquisition Corporation Class A Common Stock,2000-01-01,0
HCARU,Healthcare Services Acquisition Corporation Unit,2000-01-01,0
HCARW,Healthcare Services Acquisition Corporation Warrant,2000-01-01,0
HCAT,Health Catalyst Inc Common Stock,2000-01-01,0
HCCC,Healthcare Capital Corp. Class A common stock,2000-01-01,0
HCCCU,Healthcare Capital Corp. Unit,2000-01-01,0
HCCCW,Healthcare Capital Corp. Warrant,2000-01-01,0
HCCI,Heritage-Crystal Clean Inc. Common Stock,2000-01-01,0
HCDI,Harbor Custom Development Inc. Common Stock,2000-01-01,0
HCIC,Hennessy Capital Investment Corp. V Class A Common Stock,2000-01-01,0
HCICU,Hennessy Capital Investment Corp. V Units ,2000-01-01,0
HCICW,Hennessy Capital Investment Corp. V Warrant,2000-01-01,0
HCII,Hudson Executive Investment Corp. II Class A Common Stock,2000-01-01,0
HCIIU,Hudson Executive Investment Corp. II Unit,2000-01-01,0
HCIIW,Hudson Executive Investment Corp. II Warrant,2000-01-01,0
HCKT,Hackett Group Inc (The). Common Stock,2000-01-01,0
HCM,HUTCHMED (China) Limited American Depositary Shares,2000-01-01,0
HCSG,Healthcare Services Group Inc. Common Stock,2000-01-01,0
HDSN,Hudson Technologies Inc. Common Stock,2000-01-01,0
HEAR,Turtle Beach Corporation Common Stock,2000-01-01,0
HEC,Hudson Executive Investment Corp. Class A Common Stock,2000-01-01,0
HECCU,Hudson Executive Investment Corp. Units,2000-01-01,0
HECCW,Hudson Executive Investment Corp. Warrant,2000-01-01,0
HEES,H&E Equipment Services Inc. Common Stock,2000-01-01,0
HELE,Helen of Troy Limited Common Stock,2000-01-01,0
HEPA,Hepion Pharmaceuticals Inc. Common Stock,2000-01-01,0
HERA,FTAC Hera Acquisition Corp. Class A Ordinary Shares,2000-01-01,0
HERAU,FTAC Hera Acquisition Corp. Units,2000-01-01,0
HERAW,FTAC Hera Acquisition Corp. Warrant,2000-01-01,0
HFBL,Home Federal Bancorp Inc. of Louisiana Common StocK,2000-01-01,0
HFFG,HF Foods Group Inc. Common Stock,2000-01-01,0
HFWA,Heritage Financial Corporation Common Stock,2000-01-01,0
HGBL,Heritage Global Inc. Common Stock,2000-01-01,0
HGEN,Humanigen Inc. Common Stock,2000-01-01,0
HGSH,China HGS Real Estate Inc. Common Stock,2000-01-01,0
HHR,HeadHunter Group PLC American Depositary Shares,2000-01-01,0
HIBB,Hibbett Sports Inc. Common Stock,2000-01-01,0
HIFS,Hingham Institution for Savings Common Stock,2000-01-01,0
HIHO,Highway Holdings Limited Common Stock,2000-01-01,0
HIII,Hudson Executive Investment Corp. III Class A Common Stock,2000-01-01,0
HIIIU,Hudson Executive Investment Corp. III Unit,2000-01-01,0
HIIIW,Hudson Executive Investment Corp. III Warrant,2000-01-01,0
HIMX,Himax Technologies Inc. American Depositary Shares,2000-01-01,0
HJLI,Hancock Jaffe Laboratories Inc. Common Stock,2000-01-01,0
HJLIW,Hancock Jaffe Laboratories Inc. Warrants,2000-01-01,0
HLAH,Hamilton Lane Alliance Holdings I Inc. Class A Common Stock,2000-01-01,0
HLG,Hailiang Education Group Inc. American Depositary Shares,2000-01-01,0
HLIO,Helios Technologies Inc. Common Stock,2000-01-01,0
HLIT,Harmonic Inc. Common Stock,2000-01-01,0
HLNE,Hamilton Lane Incorporated Class A Common Stock,2000-01-01,0
HLXA,Helix Acquisition Corp. Class A Ordinary Shares,2000-01-01,0
HMCO,HumanCo Acquisition Corp. Class A Common Stock,2000-01-01,0
HMCOU,HumanCo Acquisition Corp. Unit,2000-01-01,0
HMCOW,HumanCo Acquisition Corp. Warrant,2000-01-01,0
HMHC,Houghton Mifflin Harcourt Company Common Stock,2000-01-01,0
HMNF,HMN Financial Inc. Common Stock,2000-01-01,0
HMPT,Home Point Capital Inc Common Stock,2000-01-01,0
HMST,HomeStreet Inc. Common Stock,2000-01-01,0
HMTV,Hemisphere Media Group Inc. Class A Common Stock,2000-01-01,0
HNNA,Hennessy Advisors Inc. Common Stock,2000-01-01,0
HNRG,Hallador Energy Company Common Stock,2000-01-01,0
HNST,The Honest Company Inc. Common Stock,2000-01-01,0
HOFT,Hooker Furniture Corporation Common Stock,2000-01-01,0
HOFV,Hall of Fame Resort & Entertainment Company Common Stock,2000-01-01,0
HOFVW,Hall of Fame Resort &amp; Entertainment Company Warrant,2000-01-01,0
HOL,Holicity Inc. Class A Common Stock,2000-01-01,0
HOLI,Hollysys Automation Technologies Ltd. Common Shares (British Virgin Islands),2000-01-01,0
HOLUU,Holicity Inc. Unit,2000-01-01,0
HOLUW,Holicity Inc. Warrant,2000-01-01,0
HOLX,Hologic Inc. Common Stock,2000-01-01,0
HOMB,Home BancShares Inc. Common Stock,2000-01-01,0
HON,Honeywell International Inc. Common Stock,2000-01-01,0
HONE,HarborOne Bancorp Inc. Common Stock,2000-01-01,0
HOOK,HOOKIPA Pharma Inc. Common Stock,2000-01-01,0
HOPE,Hope Bancorp Inc. Common Stock,2000-01-01,0
HOTH,Hoth Therapeutics Inc. Common Stock,2000-01-01,0
HOVNP,Hovnanian Enterprises Inc Dep Shr Srs A Pfd,2000-01-01,0
HOWL,Werewolf Therapeutics Inc. Common Stock,2000-01-01,0
HPK,HighPeak Energy Inc. Common Stock,2000-01-01,0
HPKEW,HighPeak Energy Inc. Warrant,2000-01-01,0
HQI,HireQuest Inc. Common Stock (DE),2000-01-01,0
HQY,HealthEquity Inc. Common Stock,2000-01-01,0
HRMY,Harmony Biosciences Holdings Inc. Common Stock,2000-01-01,0
HROW,Harrow Health Inc. Common Stock,2000-01-01,0
HROWL,Harrow Health Inc. 8.625% Senior Notes due 2026,2000-01-01,0
HRTX,Heron Therapeutics Inc. Common Stock,2000-01-01,0
HRZN,Horizon Technology Finance Corporation Common Stock,2000-01-01,0
HSAQ,Health Sciences Acquisitions Corporation 2 Ordinary Shares,2000-01-01,0
HSDT,Helius Medical Technologies Inc. Class A Common Stock (DE),2000-01-01,0
HSIC,Henry Schein Inc. Common Stock,2000-01-01,0
HSII,Heidrick & Struggles International Inc. Common Stock,2000-01-01,0
HSKA,Heska Corporation Common Stock,2000-01-01,0
HSON,Hudson Global Inc. Common Stock,2000-01-01,0
HST,Host Hotels & Resorts Inc. Common Stock,2000-01-01,0
HSTM,HealthStream Inc. Common Stock,2000-01-01,0
HSTO,Histogen Inc. Common Stock,2000-01-01,0
HTBI,HomeTrust Bancshares Inc. Common Stock,2000-01-01,0
HTBK,Heritage Commerce Corp Common Stock,2000-01-01,0
HTBX,Heat Biologics Inc. Common Stock,2000-01-01,0
HTGM,HTG Molecular Diagnostics Inc. Common Stock,2000-01-01,0
HTHT,Huazhu Group Limited American Depositary Shares,2000-01-01,0
HTIA,Healthcare Trust Inc. 7.375% Series A Cumulative Redeemable Perpetual Preferred Stock,2000-01-01,0
HTLD,Heartland Express Inc. Common Stock,2000-01-01,0
HTLF,Heartland Financial USA Inc. Common Stock,2000-01-01,0
HTLFP,Heartland Financial USA Inc. Depositary Shares each representing a 1/400th ownership interest in a share of 7.00% Fixed-Rate Reset Non-Cumulative Perpetual Preferred Stock Series E,2000-01-01,0
HTOO,Fusion Fuel Green PLC Class A Ordinary Shares,2000-01-01,0
HTOOW,Fusion Fuel Green PLC Warrant,2000-01-01,0
HUBG,Hub Group Inc. Class A Common Stock,2000-01-01,0
HUDI,Huadi International Group Co. Ltd. Ordinary Shares,2000-01-01,0
HUGE,FSD Pharma Inc. Class B Subordinate Voting Shares,2000-01-01,0
HUIZ,Huize Holding Limited American Depositary Shares,2000-01-01,0
HURC,Hurco Companies Inc. Common Stock,2000-01-01,0
HURN,Huron Consulting Group Inc. Common Stock,2000-01-01,0
HUSN,Hudson Capital Inc. Ordinary Shares,2000-01-01,0
HVBC,HV Bancorp Inc. Common Stock,2000-01-01,0
HWBK,Hawthorn Bancshares Inc. Common Stock,2000-01-01,0
HWC,Hancock Whitney Corporation Common Stock,2000-01-01,0
HWCC,Houston Wire & Cable Company Common Stock,2000-01-01,0
HWCPL,Hancock Whitney Corporation 5.95% Subordinated Notes due 2045,2000-01-01,0
HWCPZ,Hancock Whitney Corporation 6.25% Subordinated Notes due 2060,2000-01-01,0
HWKN,Hawkins Inc. Common Stock,2000-01-01,0
HX,Xiaobai Maimai Inc. ADR,2000-01-01,0
HYACU,Haymaker Acquisition Corp. III Unit,2000-01-01,0
HYACW,Haymaker Acquisition Corp. III Warrant,2000-01-01,0
HYFM,Hydrofarm Holdings Group Inc. Common Stock,2000-01-01,0
HYMC,Hycroft Mining Holding Corporation Class A Common Stock,2000-01-01,0
HYMCL,Hycroft Mining Holding Corporation Warrants,2000-01-01,0
HYMCW,Hycroft Mining Holding Corporation  Warrant,2000-01-01,0
HYMCZ,Hycroft Mining Holding Corporation Warrant,2000-01-01,0
HYRE,HyreCar Inc. Common Stock,2000-01-01,0
HYW,Hywin Holdings Ltd. American Depositary Shares,2000-01-01,0
HZNP,Horizon Therapeutics Public Limited Company Ordinary Shares,2000-01-01,0
IAC,IAC/InterActiveCorp Common Stock,2000-01-01,0
IART,Integra LifeSciences Holdings Corporation Common Stock,2000-01-01,0
IBCP,Independent Bank Corporation Common Stock,2000-01-01,0
IBEX,IBEX Limited Common Shares,2000-01-01,0
IBKR,Interactive Brokers Group Inc. Class A Common Stock,2000-01-01,0
IBOC,International Bancshares Corporation Common Stock,2000-01-01,0
IBRX,ImmunityBio Inc. Common Stock,2000-01-01,0
IBTX,Independent Bank Group Inc Common Stock,2000-01-01,0
ICAD,iCAD Inc. Common Stock,2000-01-01,0
ICBK,County Bancorp Inc. Common Stock,2000-01-01,0
ICCC,ImmuCell Corporation Common Stock,2000-01-01,0
ICCH,ICC Holdings Inc. Common Stock,2000-01-01,0
ICFI,ICF International Inc. Common Stock,2000-01-01,0
ICHR,Ichor Holdings Ordinary Shares,2000-01-01,0
ICLK,iClick Interactive Asia Group Limited American Depositary Shares,2000-01-01,0
ICLR,ICON plc Ordinary Shares,2000-01-01,0
ICMB,Investcorp Credit Management BDC Inc. Common Stock,2000-01-01,0
ICON,Iconix Brand Group Inc. Common Stock,2000-01-01,0
ICPT,Intercept Pharmaceuticals Inc. Common Stock,2000-01-01,0
ICUI,ICU Medical Inc. Common Stock,2000-01-01,0
IDBA,IDEX Biometrics ASA American Depositary Shares,2000-01-01,0
IDCC,InterDigital Inc. Common Stock,2000-01-01,0
IDEX,Ideanomics Inc. Common Stock,2000-01-01,0
IDN,Intellicheck Inc. Common Stock,2000-01-01,0
IDRA,Idera Pharmaceuticals Inc. Common Stock,2000-01-01,0
IDXX,IDEXX Laboratories Inc. Common Stock,2000-01-01,0
IDYA,IDEAYA Biosciences Inc. Common Stock,2000-01-01,0
IEA,Infrastructure and Energy Alternatives Inc. Common Stock,2000-01-01,0
IEAWW,Infrastructure and Energy Alternatives Inc. Warrant,2000-01-01,0
IEC,IEC Electronics Corp. Common Stock,2000-01-01,0
IEP,Icahn Enterprises L.P. Common Stock,2000-01-01,0
IESC,IES Holdings Inc. Common Stock,2000-01-01,0
IFBD,Infobird Co. Ltd Ordinary Shares,2000-01-01,0
IFMK,iFresh Inc. Common Stock,2000-01-01,0
IFRX,InflaRx N.V. Common Stock,2000-01-01,0
IGAC,IG Acquisition Corp. Class A Common Stock,2000-01-01,0
IGACU,IG Acquisition Corp. Unit,2000-01-01,0
IGACW,IG Acquisition Corp. Warrant,2000-01-01,0
IGIC,International General Insurance Holdings Ltd. Ordinary Share,2000-01-01,0
IGICW,International General Insurance Holdings Ltd. Warrants expiring 03/17/2025,2000-01-01,0
IGMS,IGM Biosciences Inc. Common Stock,2000-01-01,0
IGNY,Ignyte Acquisition Corp. Common Stock,2000-01-01,0
IGNYU,Ignyte Acquisition Corp. Unit,2000-01-01,0
IGNYW,Ignyte Acquisition Corp. Warrant,2000-01-01,0
IHRT,iHeartMedia Inc. Class A Common Stock,2000-01-01,0
III,Information Services Group Inc. Information Services Group Inc. Common Stock,2000-01-01,0
IIII,INSU Acquisition Corp. III Class A Common Stock,2000-01-01,0
IIIIU,INSU Acquisition Corp. III Unit,2000-01-01,0
IIIIW,INSU Acquisition Corp. III Warrant,2000-01-01,0
IIIV,i3 Verticals Inc. Class A Common Stock,2000-01-01,0
IIN,Intricon Corporation Common Stock,2000-01-01,0
IIVI,II-VI Incorporated Common Stock,2000-01-01,0
IIVIP,II-VI Incorporated 6.00% Series A Mandatory Convertible Preferred Stock,2000-01-01,0
IKNA,Ikena Oncology Inc. Common Stock,2000-01-01,0
IKNX,Ikonics Corporation,2000-01-01,0
IKT,Inhibikase Therapeutics Inc. Common Stock,2000-01-01,0
ILMN,Illumina Inc. Common Stock,2000-01-01,0
ILPT,Industrial Logistics Properties Trust Common Shares of Beneficial Interest,2000-01-01,0
IMAB,I-MAB American Depositary Shares,2000-01-01,0
IMAC,IMAC Holdings Inc. Common Stock,2000-01-01,0
IMACW,IMAC Holdings Inc. Warrant,2000-01-01,0
IMBI,iMedia Brands Inc. Class A Common Stock,2000-01-01,0
IMCC,IM Cannabis Corp. Common Shares,2000-01-01,0
IMCR,Immunocore Holdings plc American Depositary Shares,2000-01-01,0
IMGN,ImmunoGen Inc. Common Stock,2000-01-01,0
IMKTA,Ingles Markets Incorporated Class A Common Stock,2000-01-01,0
IMMP,Immutep Limited American Depositary Shares,2000-01-01,0
IMMR,Immersion Corporation Common Stock,2000-01-01,0
IMNM,Immunome Inc. Common Stock,2000-01-01,0
IMOS,ChipMOS TECHNOLOGIES INC. American Depositary Shares,2000-01-01,0
IMPL,Impel NeuroPharma Inc. Common Stock,2000-01-01,0
IMRA,IMARA Inc. Common Stock,2000-01-01,0
IMRN,Immuron Limited American Depositary Shares,2000-01-01,0
IMTE,Integrated Media Technology Limited Ordinary Shares,2000-01-01,0
IMTX,Immatics N.V. Ordinary Shares,2000-01-01,0
IMTXW,Immatics N.V. Warrants,2000-01-01,0
IMUX,Immunic Inc. Common Stock,2000-01-01,0
IMV,IMV Inc. Common Shares,2000-01-01,0
IMVT,Immunovant Inc. Common Stock,2000-01-01,0
IMXI,International Money Express Inc. Common Stock,2000-01-01,0
INBK,First Internet Bancorp Common Stock,2000-01-01,0
INBKL,First Internet Bancorp 6.0% Fixed-to-Floating Rate Subordinated Notes due 2026,2000-01-01,0
INBKZ,First Internet Bancorp 6.0% Fixed-to-Floating Rate Subordinated Notes Due 2029,2000-01-01,0
INBX,Inhibrx Inc. Common Stock,2000-01-01,0
INCY,Incyte Corp. Common Stock,2000-01-01,0
INDB,Independent Bank Corp. Common Stock,2000-01-01,0
INDT,INDUS Realty Trust Inc. (MD) Common Stock,2000-01-01,0
INFI,Infinity Pharmaceuticals Inc. Common Stock,2000-01-01,0
INFN,Infinera Corporation Common Stock,2000-01-01,0
INGN,Inogen Inc Common Stock,2000-01-01,0
INKA,KludeIn I Acquisition Corp. Class A Common Stock,2000-01-01,0
INKAU,KludeIn I Acquisition Corp. Unit,2000-01-01,0
INKAW,KludeIn I Acquisition Corp. Warrant,2000-01-01,0
INM,InMed Pharmaceuticals Inc. Common Shares,2000-01-01,0
INMB,INmune Bio Inc. Common stock,2000-01-01,0
INMD,InMode Ltd. Ordinary Shares,2000-01-01,0
INNV,InnovAge Holding Corp. Common Stock,2000-01-01,0
INO,Inovio Pharmaceuticals Inc. Common Stock,2000-01-01,0
INOD,Innodata Inc. Common Stock,2000-01-01,0
INOV,Inovalon Holdings Inc. Class A Common Stock,2000-01-01,0
INPX,Inpixon Common Stock,2000-01-01,0
INSE,Inspired Entertainment Inc. Common Stock,2000-01-01,0
INSG,Inseego Corp. Common Stock,2000-01-01,0
INSM,Insmed Inc. Common Stock,2000-01-01,0
INTC,Intel Corporation Common Stock,2000-01-01,0
INTG,Intergroup Corporation (The) Common Stock,2000-01-01,0
INTU,Intuit Inc. Common Stock,2000-01-01,0
INTZ,Intrusion Inc. Common Stock,2000-01-01,0
INVA,Innoviva Inc. Common Stock,2000-01-01,0
INVE,Identiv Inc. Common Stock,2000-01-01,0
INVO,INVO BioScience Inc. Common Stock,2000-01-01,0
INVZ,Innoviz Technologies Ltd. Ordinary shares,2000-01-01,0
INVZW,Innoviz Technologies Ltd. Warrant,2000-01-01,0
INZY,Inozyme Pharma Inc. Common Stock,2000-01-01,0
IONS,Ionis Pharmaceuticals Inc. Common Stock,2000-01-01,0
IOSP,Innospec Inc. Common Stock,2000-01-01,0
IOVA,Iovance Biotherapeutics Inc. Common Stock,2000-01-01,0
IPA,ImmunoPrecise Antibodies Ltd. Common Stock,2000-01-01,0
IPAR,Inter Parfums Inc. Common Stock,2000-01-01,0
IPDN,Professional Diversity Network Inc. Common Stock,2000-01-01,0
IPGP,IPG Photonics Corporation Common Stock,2000-01-01,0
IPHA,Innate Pharma S.A. ADS,2000-01-01,0
IPLDP,Interstate Power & Light Company Perp Prd Ser D,2000-01-01,0
IPVI,InterPrivate IV InfraTech Partners Inc. Class A Common Stock,2000-01-01,0
IPVIU,InterPrivate IV InfraTech Partners Inc. Units,2000-01-01,0
IPVIW,InterPrivate IV InfraTech Partners Inc. Warrant,2000-01-01,0
IPW,iPower Inc. Common Stock,2000-01-01,0
IPWR,Ideal Power Inc. Common Stock,2000-01-01,0
IQ,iQIYI Inc. American Depositary Shares,2000-01-01,0
IRBT,iRobot Corporation Common Stock,2000-01-01,0
IRCP,IRSA Propiedades Comerciales S.A. American Depositary Shares,2000-01-01,0
IRDM,Iridium Communications Inc Common Stock,2000-01-01,0
IRIX,IRIDEX Corporation Common Stock,2000-01-01,0
IRMD,iRadimed Corporation Common Stock,2000-01-01,0
IROQ,IF Bancorp Inc. Common Stock,2000-01-01,0
IRTC,iRhythm Technologies Inc. Common Stock,2000-01-01,0
IRWD,Ironwood Pharmaceuticals Inc. Class A Common Stock,2000-01-01,0
ISBC,Investors Bancorp Inc. Common Stock,2000-01-01,0
ISEE,IVERIC bio Inc. Common Stock,2000-01-01,0
ISIG,Insignia Systems Inc. Common Stock,2000-01-01,0
ISLE,Isleworth Healthcare Acquisition Corporation Common stock,2000-01-01,0
ISLEW,Isleworth Healthcare Acquisition Corporation Warrant,2000-01-01,0
ISNS,Image Sensing Systems Inc. Common Stock,2000-01-01,0
ISRG,Intuitive Surgical Inc. Common Stock,2000-01-01,0
ISSC,Innovative Solutions and Support Inc. Common Stock,2000-01-01,0
ISTR,Investar Holding Corporation Common Stock,2000-01-01,0
ISUN,iSun Inc. Common Stock,2000-01-01,0
ITAC,Industrial Tech Acquisitions Inc. Class A common stock,2000-01-01,0
ITACU,Industrial Tech Acquisitions Inc. Unit,2000-01-01,0
ITACW,Industrial Tech Acquisitions Inc. Warrant,2000-01-01,0
ITCI,Intra-Cellular Therapies Inc. Common Stock,2000-01-01,0
ITHX,ITHAX Acquisition Corp. Class A Ordinary Shares,2000-01-01,0
ITHXU,ITHAX Acquisition Corp. Unit,2000-01-01,0
ITHXW,ITHAX Acquisition Corp. Warrant,2000-01-01,0
ITI,Iteris Inc. Common Stock,2000-01-01,0
ITIC,Investors Title Company Common Stock,2000-01-01,0
ITMR,Itamar Medical Ltd. American Depository Shares,2000-01-01,0
ITOS,iTeos Therapeutics Inc. Common Stock,2000-01-01,0
ITQ,Itiquira Acquisition Corp. Class A Ordinary Shares,2000-01-01,0
ITQRU,Itiquira Acquisition Corp. Unit,2000-01-01,0
ITQRW,Itiquira Acquisition Corp. Warrant,2000-01-01,0
ITRI,Itron Inc. Common Stock,2000-01-01,0
ITRM,Iterum Therapeutics plc Ordinary Share,2000-01-01,0
ITRN,Ituran Location and Control Ltd. Ordinary Shares,2000-01-01,0
IVA,Inventiva S.A. American Depository Shares,2000-01-01,0
IVAC,Intevac Inc. Common Stock,2000-01-01,0
IZEA,IZEA Worldwide Inc. Common Stock,2000-01-01,0
JACK,Jack In The Box Inc. Common Stock,2000-01-01,0
JAGX,Jaguar Health Inc. Common Stock,2000-01-01,0
JAKK,JAKKS Pacific Inc. Common Stock,2000-01-01,0
JAMF,Jamf Holding Corp. Common Stock,2000-01-01,0
JAN,JanOne Inc. Common Stock (NV),2000-01-01,0
JAZZ,Jazz Pharmaceuticals plc Common Stock (Ireland),2000-01-01,0
JBHT,J.B. Hunt Transport Services Inc. Common Stock,2000-01-01,0
JBLU,JetBlue Airways Corporation Common Stock,2000-01-01,0
JBSS,John B. Sanfilippo & Son Inc. Common Stock,2000-01-01,0
JCIC,Jack Creek Investment Corp. Class A Ordinary Shares,2000-01-01,0
JCICU,Jack Creek Investment Corp. Units,2000-01-01,0
JCICW,Jack Creek Investment Corp. Warrants,2000-01-01,0
JCOM,j2 Global Inc. Common Stock,2000-01-01,0
JCS,Communications Systems Inc. Common Stock,2000-01-01,0
JCTCF,Jewett-Cameron Trading Company Common Shares,2000-01-01,0
JD,JD.com Inc. American Depositary Shares,2000-01-01,0
JFIN,Jiayin Group Inc. American Depositary Shares,2000-01-01,0
JFU,9F Inc. American Depositary Shares,2000-01-01,0
JG,Aurora Mobile Limited American Depositary Shares,2000-01-01,0
JJSF,J & J Snack Foods Corp. Common Stock,2000-01-01,0
JKHY,Jack Henry & Associates Inc. Common Stock,2000-01-01,0
JMPNL,JMP Group LLC 7.25% Senior Notes due 2027,2000-01-01,0
JMPNZ,JMP Group LLC 6.875% Senior Notes due 2029,2000-01-01,0
JNCE,Jounce Therapeutics Inc. Common Stock,2000-01-01,0
JOAN,JOANN Inc. Common Stock,2000-01-01,0
JOBS,51job Inc. American Depositary Shares,2000-01-01,0
JOFF,JOFF Fintech Acquisition Corp. Class A Common Stock,2000-01-01,0
JOFFU,JOFF Fintech Acquisition Corp. Unit,2000-01-01,0
JOFFW,JOFF Fintech Acquisition Corp. Warrant,2000-01-01,0
JOUT,Johnson Outdoors Inc. Class A Common Stock,2000-01-01,0
JRJC,China Finance Online Co. Limited American Depositary Shares,2000-01-01,0
JRSH,Jerash Holdings (US) Inc. Common Stock,2000-01-01,0
JRVR,James River Group Holdings Ltd. Common Shares,2000-01-01,0
JSM,Navient Corporation 6% Senior Notes due December 15 2043,2000-01-01,0
JUPW,Jupiter Wellness Inc. Common Stock,2000-01-01,0
JUPWW,Jupiter Wellness Inc. Warrant,2000-01-01,0
JVA,Coffee Holding Co. Inc. Common Stock,2000-01-01,0
JWEL,Jowell Global Ltd. Ordinary Shares,2000-01-01,0
JYAC,Jiya Acquisition Corp. Class A Common Stock,2000-01-01,0
JYNT,The Joint Corp. Common Stock,2000-01-01,0
JZXN,Jiuzi Holdings Inc. Ordinary Shares,2000-01-01,0
KAII,Kismet Acquisition Two Corp. Class A Ordinary Shares,2000-01-01,0
KAIIU,Kismet Acquisition Two Corp. Unit,2000-01-01,0
KAIIW,Kismet Acquisition Two Corp. Warrant,2000-01-01,0
KAIR,Kairos Acquisition Corp. Class A Ordinary Shares,2000-01-01,0
KAIRU,Kairos Acquisition Corp. Unit,2000-01-01,0
KAIRW,Kairos Acquisition Corp. Warrant,2000-01-01,0
KALA,Kala Pharmaceuticals Inc. Common Stock,2000-01-01,0
KALU,Kaiser Aluminum Corporation Common Stock,2000-01-01,0
KALV,KalVista Pharmaceuticals Inc. Common Stock,2000-01-01,0
KARO,Karooooo Ltd. Ordinary Shares,2000-01-01,0
KBAL,Kimball International Inc. Class B Common Stock,2000-01-01,0
KBNT,Kubient Inc. Common Stock,2000-01-01,0
KBNTW,Kubient Inc. Warrant,2000-01-01,0
KBSF,KBS Fashion Group Limited Common Stock,2000-01-01,0
KC,Kingsoft Cloud Holdings Limited American Depositary Shares,2000-01-01,0
KCAPL,KCAP Financial Inc. 6.125% Notes due 2022,2000-01-01,0
KDMN,Kadmon Holdings Inc. Common Stock,2000-01-01,0
KDNY,Chinook Therapeutics Inc. Common Stock,2000-01-01,0
KDP,Keurig Dr Pepper Inc. Common Stock,2000-01-01,0
KE,Kimball Electronics Inc. Common Stock,2000-01-01,0
KELYA,Kelly Services Inc. Class A Common Stock,2000-01-01,0
KELYB,Kelly Services Inc. Class B Common Stock,2000-01-01,0
KEQU,Kewaunee Scientific Corporation Common Stock,2000-01-01,0
KERN,Akerna Corp. Common Stock,2000-01-01,0
KERNW,Akerna Corp Warrant,2000-01-01,0
KFFB,Kentucky First Federal Bancorp Common Stock,2000-01-01,0
KFRC,Kforce Inc. Common Stock,2000-01-01,0
KHC,The Kraft Heinz Company Common Stock,2000-01-01,0
KIDS,OrthoPediatrics Corp. Common Stock,2000-01-01,0
KIIIU,Kismet Acquisition Three Corp. Unit,2000-01-01,0
KIIIW,Kismet Acquisition Three Corp. Warrant,2000-01-01,0
KIN,Kindred Biosciences Inc. Common Stock,2000-01-01,0
KINS,Kingstone Companies Inc. Common Stock,2000-01-01,0
KINZ,KINS Technology Group Inc. Class A Common Stock,2000-01-01,0
KINZU,KINS Technology Group Inc. Unit,2000-01-01,0
KINZW,KINS Technology Group Inc. Warrant,2000-01-01,0
KIRK,Kirkland's Inc. COMMONSTOCK,2000-01-01,0
KLAC,KLA Corporation Common Stock,2000-01-01,0
KLAQ,KL Acquisition Corp Class A Common Stock,2000-01-01,0
KLAQU,KL Acquisition Corp Unit,2000-01-01,0
KLAQW,KL Acquisition Corp Warrant,2000-01-01,0
KLDO,Kaleido Biosciences Inc. Common Stock,2000-01-01,0
KLIC,Kulicke and Soffa Industries Inc. Common Stock,2000-01-01,0
KLXE,KLX Energy Services Holdings Inc. Common Stock,2000-01-01,0
KMDA,Kamada Ltd. Ordinary Shares,2000-01-01,0
KMPH,KemPharm Inc. Common Stock,2000-01-01,0
KNBE,KnowBe4 Inc. Class A Common Stock,2000-01-01,0
KNDI,Kandi Technologies Group Inc Common Stock,2000-01-01,0
KNSA,Kiniksa Pharmaceuticals Ltd. Class A Common Stock,2000-01-01,0
KNSL,Kinsale Capital Group Inc. Common Stock,2000-01-01,0
KNTE,Kinnate Biopharma Inc. Common Stock,2000-01-01,0
KOD,Kodiak Sciences Inc Common Stock,2000-01-01,0
KOPN,Kopin Corporation Common Stock,2000-01-01,0
KOR,Corvus Gold Inc. Common Shares,2000-01-01,0
KOSS,Koss Corporation Common Stock,2000-01-01,0
KPTI,Karyopharm Therapeutics Inc. Common Stock,2000-01-01,0
KRBP,Kiromic BioPharma Inc. Common Stock,2000-01-01,0
KRKR,36Kr Holdings Inc. American Depositary Shares,2000-01-01,0
KRMD,Repro Med Systems Inc. Common Stock,2000-01-01,0
KRNL,Kernel Group Holdings Inc. Class A Ordinary Shares,2000-01-01,0
KRNLU,Kernel Group Holdings Inc. Units,2000-01-01,0
KRNLW,Kernel Group Holdings Inc. Warrants,2000-01-01,0
KRNT,Kornit Digital Ltd. Ordinary Shares,2000-01-01,0
KRNY,Kearny Financial Corp Common Stock,2000-01-01,0
KRON,Kronos Bio Inc. Common Stock,2000-01-01,0
KROS,Keros Therapeutics Inc. Common Stock,2000-01-01,0
KRT,Karat Packaging Inc. Common Stock,2000-01-01,0
KRTX,Karuna Therapeutics Inc. Common Stock,2000-01-01,0
KRUS,Kura Sushi USA Inc. Class A Common Stock,2000-01-01,0
KRYS,Krystal Biotech Inc. Common Stock,2000-01-01,0
KSI,Kadem Sustainable Impact Corporation Class A common stock,2000-01-01,0
KSICU,Kadem Sustainable Impact Corporation Unit,2000-01-01,0
KSICW,Kadem Sustainable Impact Corporation Warrant,2000-01-01,0
KSMT,Kismet Acquisition One Corp Ordinary Shares,2000-01-01,0
KSMTU,Kismet Acquisition One Corp Unit,2000-01-01,0
KSMTW,Kismet Acquisition One Corp Warrant,2000-01-01,0
KSPN,Kaspien Holdings Inc. Common Stock,2000-01-01,0
KTCC,Key Tronic Corporation Common Stock,2000-01-01,0
KTOS,Kratos Defense & Security Solutions Inc. Common Stock,2000-01-01,0
KTRA,Kintara Therapeutics Inc. Common Stock,2000-01-01,0
KURA,Kura Oncology Inc. Common Stock,2000-01-01,0
KURI,Alkuri Global Acquisition Corp. Class A common stock,2000-01-01,0
