tag,company,last_update,last_values
AACG,ATA Creativity Global American Depositary Shares,2000-01-01,0
AACQ,Artius Acquisition Inc. Class A Common Stock,2000-01-01,0
AACQU,Artius Acquisition Inc. Unit ,2000-01-01,0
AACQW,Artius Acquisition Inc Warrant,2000-01-01,0
AAL,American Airlines Group Inc. Common Stock,2000-01-01,0
AAME,Atlantic American Corporation Common Stock,2000-01-01,0
AAOI,Applied Optoelectronics Inc. Common Stock,2000-01-01,0
AAON,AAON Inc. Common Stock,2000-01-01,0
AAPL,Apple Inc. Common Stock,2000-01-01,0
AAWW,Atlas Air Worldwide Holdings NEW Common Stock,2000-01-01,0
ABCB,Ameris Bancorp Common Stock,2000-01-01,0
ABCL,AbCellera Biologics Inc. Common Shares,2000-01-01,0
ABCM,Abcam plc American Depositary Shares,2000-01-01,0
ABEO,Abeona Therapeutics Inc. Common Stock,2000-01-01,0
ABGI,ABG Acquisition Corp. I Class A Ordinary Shares,2000-01-01,0
ABIO,ARCA biopharma Inc. Common Stock,2000-01-01,0
ABMD,ABIOMED Inc. Common Stock,2000-01-01,0
ABNB,Airbnb Inc. Class A Common Stock,2000-01-01,0
ABST,Absolute Software Corporation Common Stock,2000-01-01,0
ABTX,Allegiance Bancshares Inc. Common Stock,2000-01-01,0
ABUS,Arbutus Biopharma Corporation Common Stock,2000-01-01,0
ACAC,Acies Acquisition Corp. Class A Ordinary Share,2000-01-01,0
ACACU,Acies Acquisition Corp. Unit,2000-01-01,0
ACACW,Acies Acquisition Corp. Warrant,2000-01-01,0
ACAD,ACADIA Pharmaceuticals Inc. Common Stock,2000-01-01,0
ACAH,Atlantic Coastal Acquisition Corp. Class A Common Stock,2000-01-01,0
ACAHU,Atlantic Coastal Acquisition Corp. Unit,2000-01-01,0
ACAHW,Atlantic Coastal Acquisition Corp. Warrant,2000-01-01,0
ACB,Aurora Cannabis Inc. Common Shares,2000-01-01,0
ACBA,Ace Global Business Acquisition Limited Ordinary Shares,2000-01-01,0
ACBAU,Ace Global Business Acquisition Limited Unit,2000-01-01,0
ACBAW,Ace Global Business Acquisition Limited Warrant,2000-01-01,0
ACBI,Atlantic Capital Bancshares Inc. Common Stock,2000-01-01,0
ACCD,Accolade Inc. Common Stock,2000-01-01,0
ACER,Acer Therapeutics Inc. Common Stock (DE),2000-01-01,0
ACET,Adicet Bio Inc. Common Stock ,2000-01-01,0
ACEV,ACE Convergence Acquisition Corp. Class A Ordinary Shares,2000-01-01,0
ACEVU,ACE Convergence Acquisition Corp. Unit,2000-01-01,0
ACEVW,ACE Convergence Acquisition Corp. Warrant,2000-01-01,0
ACGL,Arch Capital Group Ltd. Common Stock,2000-01-01,0
ACGLO,Arch Capital Group Ltd. Depositary Shares Each Representing 1/1000th Interest in a Share of 5.45% Non-Cumulative Preferred Shares Series F,2000-01-01,0
ACGLP,Arch Capital Group Ltd. Depositary Shares Representing Interest in 5.25% Non-Cumulative Preferred Series E Shrs,2000-01-01,0
ACHC,Acadia Healthcare Company Inc. Common Stock,2000-01-01,0
ACHL,Achilles Therapeutics plc American Depositary Shares,2000-01-01,0
ACHV,Achieve Life Sciences Inc. Common Shares,2000-01-01,0
ACIU,AC Immune SA Common Stock,2000-01-01,0
ACIW,ACI Worldwide Inc. Common Stock,2000-01-01,0
ACKIT,Ackrell SPAC Partners I Co. Subunits,2000-01-01,0
ACKIU,Ackrell SPAC Partners I Co. Units,2000-01-01,0
ACKIW,Ackrell SPAC Partners I Co. Warrants,2000-01-01,0
ACLS,Axcelis Technologies Inc. Common Stock,2000-01-01,0
ACMR,ACM Research Inc. Class A Common Stock,2000-01-01,0
ACNB,ACNB Corporation Common Stock,2000-01-01,0
ACOR,Acorda Therapeutics Inc. Common Stock,2000-01-01,0
ACQR,Independence Holdings Corp. Class A Ordinary Share,2000-01-01,0
ACQRU,Independence Holdings Corp. Units,2000-01-01,0
ACQRW,Independence Holdings Corp. Warrant,2000-01-01,0
ACRS,Aclaris Therapeutics Inc. Common Stock,2000-01-01,0
ACRX,AcelRx Pharmaceuticals Inc. Common Stock,2000-01-01,0
ACST,Acasti Pharma Inc. Class A Common Stock,2000-01-01,0
ACTC,ArcLight Clean Transition Corp. Class A Ordinary Shares,2000-01-01,0
ACTCU,ArcLight Clean Transition Corp. Unit,2000-01-01,0
ACTCW,ArcLight Clean Transition Corp. Warrant,2000-01-01,0
ACTD,ArcLight Clean Transition Corp. II Class A Ordinary Share,2000-01-01,0
ACTDU,ArcLight Clean Transition Corp. II Unit,2000-01-01,0
ACTDW,ArcLight Clean Transition Corp. II Warrant,2000-01-01,0
ACTG,Acacia Research Corporation (Acacia Tech) Common Stock,2000-01-01,0
ACVA,ACV Auctions Inc. Class A Common Stock,2000-01-01,0
ADAG,Adagene Inc. American Depositary Shares,2000-01-01,0
ADAP,Adaptimmune Therapeutics plc American Depositary Shares,2000-01-01,0
ADBE,Adobe Inc. Common Stock,2000-01-01,0
ADER,26 Capital Acquisition Corp. Class A Common Stock,2000-01-01,0
ADERU,26 Capital Acquisition Corp. Unit,2000-01-01,0
ADERW,26 Capital Acquisition Corp. Warrant,2000-01-01,0
ADES,Advanced Emissions Solutions Inc. Common Stock,2000-01-01,0
ADI,Analog Devices Inc. Common Stock,2000-01-01,0
ADIL,Adial Pharmaceuticals Inc Common Stock,2000-01-01,0
ADILW,Adial Pharmaceuticals Inc Warrant,2000-01-01,0
ADMA,ADMA Biologics Inc Common Stock,2000-01-01,0
ADMP,Adamis Pharmaceuticals Corporation Common Stock,2000-01-01,0
ADMS,Adamas Pharmaceuticals Inc. Common Stock,2000-01-01,0
ADN,Advent Technologies Holdings Inc. Class A Common Stock,2000-01-01,0
ADNWW,Advent Technologies Holdings Inc. Warrant,2000-01-01,0
ADOC,Edoc Acquisition Corp. Class A Ordinary Share,2000-01-01,0
ADOCR,Edoc Acquisition Corp. Right,2000-01-01,0
ADOCW,Edoc Acquisition Corp. Warrant,2000-01-01,0
ADP,Automatic Data Processing Inc. Common Stock,2000-01-01,0
ADPT,Adaptive Biotechnologies Corporation Common Stock,2000-01-01,0
ADSK,Autodesk Inc. Common Stock,2000-01-01,0
ADTN,ADTRAN Inc. Common Stock,2000-01-01,0
ADTX,ADiTx Therapeutics Inc. Common Stock,2000-01-01,0
ADUS,Addus HomeCare Corporation Common Stock,2000-01-01,0
ADV,Advantage Solutions Inc. Class A Common Stock,2000-01-01,0
ADVM,Adverum Biotechnologies Inc. Common Stock,2000-01-01,0
ADVWW,Advantage Solutions Inc. Warrant,2000-01-01,0
ADXN,Addex Therapeutics Ltd American Depositary Shares,2000-01-01,0
ADXS,Advaxis Inc. Common Stock,2000-01-01,0
AEAC,Authentic Equity Acquisition Corp. Class A ordinary share,2000-01-01,0
AEACU,Authentic Equity Acquisition Corp. Unit,2000-01-01,0
AEACW,Authentic Equity Acquisition Corp. Warrant,2000-01-01,0
AEHL,Antelope Enterprise Holdings Limited Common Stock (0.024 par),2000-01-01,0
AEHR,Aehr Test Systems Common Stock,2000-01-01,0
AEI,Alset EHome International Inc. Common Stock,2000-01-01,0
AEIS,Advanced Energy Industries Inc. Common Stock,2000-01-01,0
AEMD,Aethlon Medical Inc. Common Stock,2000-01-01,0
AEP,American Electric Power Company Inc. Common Stock,2000-01-01,0
AEPPL,American Electric Power Company Inc. Corporate Unit,2000-01-01,0
AEPPZ,American Electric Power Company Inc. Corporate Units,2000-01-01,0
AERI,Aerie Pharmaceuticals Inc. Common Stock,2000-01-01,0
AESE,Allied Esports Entertainment Inc. Common Stock,2000-01-01,0
AEY,ADDvantage Technologies Group Inc. Common Stock,2000-01-01,0
AEYE,AudioEye Inc. Common Stock,2000-01-01,0
AEZS,Aeterna Zentaris Inc. Common Stock,2000-01-01,0
AFAQ,AF Acquisition Corp. Class A Common Stock,2000-01-01,0
AFAQU,AF Acquisition Corp. Units,2000-01-01,0
AFAQW,AF Acquisition Corp. Warrants,2000-01-01,0
AFBI,Affinity Bancshares Inc. Common Stock (MD),2000-01-01,0
AFCG,AFC Gamma Inc. Common Stock,2000-01-01,0
AFIB,Acutus Medical Inc. Common Stock,2000-01-01,0
AFIN,American Finance Trust Inc. Class A Common Stock,2000-01-01,0
AFINO,American Finance Trust Inc. 7.375% Series C Cumulative Redeemable Preferred Stock,2000-01-01,0
AFINP,American Finance Trust Inc. 7.50% Series A Cumulative Redeemable Perpetual Preferred Stock,2000-01-01,0
AFMD,Affimed N.V.,2000-01-01,0
AFRM,Affirm Holdings Inc. Class A Common Stock,2000-01-01,0
AFYA,Afya Limited Class A Common Shares,2000-01-01,0
AGBA,AGBA Acquisition Limited Ordinary Share,2000-01-01,0
AGBAR,AGBA Acquisition Limited Right,2000-01-01,0
AGBAW,AGBA Acquisition Limited Warrant,2000-01-01,0
AGC,Altimeter Growth Corp. Class A Ordinary Shares,2000-01-01,0
AGCUU,Altimeter Growth Corp. Unit,2000-01-01,0
AGCWW,Altimeter Growth Corp. Warrant,2000-01-01,0
AGEN,Agenus Inc. Common Stock,2000-01-01,0
AGFS,AgroFresh Solutions Inc. Common Stock,2000-01-01,0
AGFY,Agrify Corporation Common Stock,2000-01-01,0
AGGR,Agile Growth Corp. Class A Ordinary Share,2000-01-01,0
AGGRU,Agile Growth Corp. Units,2000-01-01,0
AGGRW,Agile Growth Corp. Warrant.,2000-01-01,0
AGIO,Agios Pharmaceuticals Inc. Common Stock,2000-01-01,0
AGLE,Aeglea BioTherapeutics Inc. Common Stock,2000-01-01,0
AGMH,AGM Group Holdings Inc. Class A Ordinary Shares,2000-01-01,0
AGNC,AGNC Investment Corp. Common Stock,2000-01-01,0
AGNCM,AGNC Investment Corp. Depositary Shares rep 6.875% Series D Fixed-to-Floating Cumulative Redeemable Preferred Stock,2000-01-01,0
AGNCN,AGNC Investment Corp. Depositary Shares Each Representing a 1/1000th Interest in a Share of 7.00% Series C Fixed-To-Floating Rate Cumulative Redeemable Preferred Stock,2000-01-01,0
AGNCO,AGNC Investment Corp. Depositary Shares each representing a 1/1000th interest in a share of 6.50% Series E Fixed-to-Floating Cumulative Redeemable Preferred Stock,2000-01-01,0
AGNCP,AGNC Investment Corp. Depositary Shares Each Representing a 1/1000th Interest in a Share of 6.125% Series F Fixed-to-Floating Rate Cumulative Redeemable Preferred Stock,2000-01-01,0
AGRX,Agile Therapeutics Inc. Common Stock,2000-01-01,0
AGTC,Applied Genetic Technologies Corporation Common Stock,2000-01-01,0
AGYS,Agilysys Inc. Common Stock,2000-01-01,0
AHAC,Alpha Healthcare Acquisition Corp. Class A Common Stock,2000-01-01,0
AHACW,Alpha Healthcare Acquisition Corp. Warrant,2000-01-01,0
AHCO,AdaptHealth Corp. Class A Common Stock,2000-01-01,0
AHPI,Allied Healthcare Products Inc. Common Stock,2000-01-01,0
AIH,Aesthetic Medical International Holdings Group Ltd. American Depositary Shares,2000-01-01,0
AIHS,Senmiao Technology Limited Common Stock,2000-01-01,0
AIKI,AIkido Pharma Inc. Common Stock,2000-01-01,0
AIMC,Altra Industrial Motion Corp. Common Stock,2000-01-01,0
AINV,Apollo Investment Corporation Common Stock,2000-01-01,0
AIRG,Airgain Inc. Common Stock,2000-01-01,0
AIRT,Air T Inc. Common Stock,2000-01-01,0
AIRTP,Air T Inc. Air T Funding Alpha Income Trust Preferred Securities,2000-01-01,0
AIRTW,Air T Inc. Air T Funding Warrants to Purchase Alpha Income Trust Preferred Expiring 08/30/2021,2000-01-01,0
AKAM,Akamai Technologies Inc. Common Stock,2000-01-01,0
AKBA,Akebia Therapeutics Inc. Common Stock,2000-01-01,0
AKIC,Sports Ventures Acquisition Corp. Class A Ordinary Shares,2000-01-01,0
AKICU,Sports Ventures Acquisition Corp. Unit,2000-01-01,0
AKICW,Sports Ventures Acquisition Corp. Warrant,2000-01-01,0
AKRO,Akero Therapeutics Inc. Common Stock,2000-01-01,0
AKTS,Akoustis Technologies Inc. Common Stock,2000-01-01,0
AKTX,Akari Therapeutics plc ADR (0.01 USD),2000-01-01,0
AKU,Akumin Inc. Common Shares,2000-01-01,0
AKUS,Akouos Inc. Common Stock,2000-01-01,0
AKYA,Akoya BioSciences Inc. Common Stock,2000-01-01,0
ALAC,Alberton Acquisition Corporation Ordinary Shares,2000-01-01,0
ALACR,Alberton Acquisition Corporation Rights exp April 26 2021,2000-01-01,0
ALACW,Alberton Acquisition Corporation Warrant,2000-01-01,0
ALBO,Albireo Pharma Inc. Common Stock,2000-01-01,0
ALCO,Alico Inc. Common Stock,2000-01-01,0
ALDX,Aldeyra Therapeutics Inc. Common Stock,2000-01-01,0
ALEC,Alector Inc. Common Stock,2000-01-01,0
ALF,ALFI Inc. Common Stock,2000-01-01,0
ALFIW,ALFI Inc. Warrant,2000-01-01,0
ALGM,Allegro MicroSystems Inc. Common Stock,2000-01-01,0
ALGN,Align Technology Inc. Common Stock,2000-01-01,0
ALGS,Aligos Therapeutics Inc. Common Stock,2000-01-01,0
ALGT,Allegiant Travel Company Common Stock,2000-01-01,0
ALHC,Alignment Healthcare Inc. Common Stock,2000-01-01,0
ALIM,Alimera Sciences Inc. Common Stock,2000-01-01,0
ALJJ,ALJ Regional Holdings Inc. Common Stock,2000-01-01,0
ALKS,Alkermes plc Ordinary Shares,2000-01-01,0
ALKT,Alkami Technology Inc. Common Stock,2000-01-01,0
ALLK,Allakos Inc. Common Stock,2000-01-01,0
ALLO,Allogene Therapeutics Inc. Common Stock,2000-01-01,0
ALLT,Allot Ltd. Ordinary Shares,2000-01-01,0
ALNA,Allena Pharmaceuticals Inc. Common Stock,2000-01-01,0
ALNY,Alnylam Pharmaceuticals Inc. Common Stock,2000-01-01,0
ALOT,AstroNova Inc. Common Stock,2000-01-01,0
ALPN,Alpine Immune Sciences Inc. Common Stock,2000-01-01,0
ALRM,Alarm.com Holdings Inc. Common Stock,2000-01-01,0
ALRN,Aileron Therapeutics Inc. Common Stock,2000-01-01,0
ALRS,Alerus Financial Corporation Common Stock,2000-01-01,0
ALSK,Alaska Communications Systems Group Inc. Common Stock,2000-01-01,0
ALT,Altimmune Inc. Common Stock,2000-01-01,0
ALTA,Altabancorp Common Stock,2000-01-01,0
ALTM,Altus Midstream Company Class A Common Stock,2000-01-01,0
ALTO,Alto Ingredients Inc. Common Stock,2000-01-01,0
ALTR,Altair Engineering Inc. Class A Common Stock,2000-01-01,0
ALTU,Altitude Acquisition Corp. Class A Common Stock,2000-01-01,0
ALTUU,Altitude Acquisition Corp. Unit,2000-01-01,0
ALTUW,Altitude Acquisition Corp. Warrant,2000-01-01,0
ALVR,AlloVir Inc. Common Stock,2000-01-01,0
ALXN,Alexion Pharmaceuticals Inc. Common Stock,2000-01-01,0
ALXO,ALX Oncology Holdings Inc. Common Stock,2000-01-01,0
ALYA,Alithya Group inc. Class A Subordinate Voting Shares,2000-01-01,0
AMAL,Amalgamated Financial Corp. Common Stock (DE),2000-01-01,0
AMAO,American Acquisition Opportunity Inc. Class A Common Stock,2000-01-01,0
AMAOU,American Acquisition Opportunity Inc. Units,2000-01-01,0
AMAOW,American Acquisition Opportunity Inc. Warrant,2000-01-01,0
AMAT,Applied Materials Inc. Common Stock,2000-01-01,0
AMBA,Ambarella Inc. Ordinary Shares,2000-01-01,0
AMCX,AMC Networks Inc. Class A Common Stock,2000-01-01,0
AMD,Advanced Micro Devices Inc. Common Stock,2000-01-01,0
AMED,Amedisys Inc Common Stock,2000-01-01,0
AMEH,Apollo Medical Holdings Inc. Common Stock,2000-01-01,0
AMGN,Amgen Inc. Common Stock,2000-01-01,0
AMHC,Amplitude Healthcare Acquisition Corporation Class A Common Stock,2000-01-01,0
AMHCU,Amplitude Healthcare Acquisition Corporation Unit,2000-01-01,0
AMHCW,Amplitude Healthcare Acquisition Corporation Warrants,2000-01-01,0
AMKR,Amkor Technology Inc. Common Stock,2000-01-01,0
AMNB,American National Bankshares Inc. Common Stock,2000-01-01,0
AMOT,Allied Motion Technologies Inc.,2000-01-01,0
AMPG,Amplitech Group Inc. Common Stock,2000-01-01,0
AMPGW,Amplitech Group Inc. Warrants,2000-01-01,0
AMPH,Amphastar Pharmaceuticals Inc. Common Stock,2000-01-01,0
AMRB,American River Bankshares Common Stock,2000-01-01,0
AMRK,A-Mark Precious Metals Inc. Common Stock,2000-01-01,0
AMRN,Amarin Corporation plc,2000-01-01,0
AMRS,Amyris Inc. Common Stock,2000-01-01,0
AMSC,American Superconductor Corporation Common Stock,2000-01-01,0
AMSF,AMERISAFE Inc. Common Stock,2000-01-01,0
AMST,Amesite Inc. Common Stock,2000-01-01,0
AMSWA,American Software Inc. Class A Common Stock,2000-01-01,0
AMTB,Amerant Bancorp Inc. Class A Common Stock,2000-01-01,0
AMTBB,Amerant Bancorp Inc. Class B Common Stock,2000-01-01,0
AMTI,Applied Molecular Transport Inc. Common Stock,2000-01-01,0
AMTX,Aemetis Inc. Common Stock,2000-01-01,0
AMWD,American Woodmark Corporation Common Stock,2000-01-01,0
AMYT,Amryt Pharma plc American Depositary Shares,2000-01-01,0
AMZN,Amazon.com Inc. Common Stock,2000-01-01,0
ANAB,AnaptysBio Inc. Common Stock,2000-01-01,0
ANAT,American National Group Inc. Common Stock,2000-01-01,0
ANDA,Andina Acquisition Corp. III Ordinary Shares,2000-01-01,0
ANDAR,Andina Acquisition Corp. III Right,2000-01-01,0
ANDAW,Andina Acquisition Corp. III Warrant,2000-01-01,0
ANDE,Andersons Inc. (The) Common Stock,2000-01-01,0
ANEB,Anebulo Pharmaceuticals Inc. Common Stock,2000-01-01,0
ANGI,Angi Inc. Class A Common Stock,2000-01-01,0
ANGN,Angion Biomedica Corp. Common Stock,2000-01-01,0
ANGO,AngioDynamics Inc. Common Stock,2000-01-01,0
ANIK,Anika Therapeutics Inc. Common Stock,2000-01-01,0
ANIP,ANI Pharmaceuticals Inc.,2000-01-01,0
ANIX,Anixa Biosciences Inc. Common Stock,2000-01-01,0
ANNX,Annexon Inc. Common Stock,2000-01-01,0
ANPC,AnPac Bio-Medical Science Co. Ltd. American Depositary Shares,2000-01-01,0
ANSS,ANSYS Inc. Common Stock,2000-01-01,0
ANTE,AirNet Technology Inc. American Depositary Shares,2000-01-01,0
ANY,Sphere 3D Corp. Common Shares,2000-01-01,0
ANZU,Anzu Special Acquisition Corp I Class A Common Stock,2000-01-01,0
ANZUU,Anzu Special Acquisition Corp I Units,2000-01-01,0
ANZUW,Anzu Special Acquisition Corp I Warrant,2000-01-01,0
AOSL,Alpha and Omega Semiconductor Limited Common Shares,2000-01-01,0
AOUT,American Outdoor Brands Inc. Common Stock ,2000-01-01,0
APA,APA Corporation Common Stock,2000-01-01,0
APDN,Applied DNA Sciences Inc. Common Stock,2000-01-01,0
APEI,American Public Education Inc. Common Stock,2000-01-01,0
APEN,Apollo Endosurgery Inc. Common Stock,2000-01-01,0
API,Agora Inc. American Depositary Shares,2000-01-01,0
APLS,Apellis Pharmaceuticals Inc. Common Stock,2000-01-01,0
APLT,Applied Therapeutics Inc. Common Stock,2000-01-01,0
APM,Aptorum Group Limited Class A Ordinary Shares,2000-01-01,0
APOG,Apogee Enterprises Inc. Common Stock,2000-01-01,0
APOP,Cellect Biotechnology Ltd. American Depositary Shares,2000-01-01,0
APOPW,Cellect Biotechnology Ltd. Warrants to Purchase ADRs,2000-01-01,0
APP,Applovin Corporation Class A Common Stock,2000-01-01,0
APPF,AppFolio Inc. Class A Common Stock,2000-01-01,0
APPH,AppHarvest Inc. Common Stock,2000-01-01,0
APPHW,AppHarvest Inc. Warrants,2000-01-01,0
APPN,Appian Corporation Class A Common Stock,2000-01-01,0
APPS,Digital Turbine Inc. Common Stock,2000-01-01,0
APR,Apria Inc. Common Stock,2000-01-01,0
APRE,Aprea Therapeutics Inc. Common stock,2000-01-01,0
APTO,Aptose Biosciences Inc. Common Shares,2000-01-01,0
APTX,Aptinyx Inc. Common Stock,2000-01-01,0
APVO,Aptevo Therapeutics Inc. Common Stock,2000-01-01,0
APWC,Asia Pacific Wire & Cable Corporation Ltd. Ordinary Shares (Bermuda),2000-01-01,0
APXT,Apex Technology Acquisition Corporation Class A Common Stock,2000-01-01,0
APXTU,Apex Technology Acquisition Corporation Unit,2000-01-01,0
APXTW,Apex Technology Acquisition Corporation Warrant,2000-01-01,0
APYX,Apyx Medical Corporation Common Stock,2000-01-01,0
AQB,AquaBounty Technologies Inc. Common Stock,2000-01-01,0
AQMS,Aqua Metals Inc. Common Stock,2000-01-01,0
AQST,Aquestive Therapeutics Inc. Common Stock,2000-01-01,0
ARAV,Aravive Inc. Common Stock,2000-01-01,0
ARAY,Accuray Incorporated Common Stock,2000-01-01,0
ARBG,Aequi Acquisition Corp. Class A Common Stock,2000-01-01,0
ARBGU,Aequi Acquisition Corp. Unit,2000-01-01,0
ARBGW,Aequi Acquisition Corp. warrants,2000-01-01,0
ARCB,ArcBest Corporation Common Stock,2000-01-01,0
ARCC,Ares Capital Corporation Common Stock,2000-01-01,0
ARCE,Arco Platform Limited Class A Common Shares,2000-01-01,0
ARCT,Arcturus Therapeutics Holdings Inc. Common Stock,2000-01-01,0
ARDS,Aridis Pharmaceuticals Inc. Common Stock,2000-01-01,0
ARDX,Ardelyx Inc. Common Stock,2000-01-01,0
AREC,American Resources Corporation Class A Common Stock,2000-01-01,0
ARGX,argenx SE American Depositary Shares,2000-01-01,0
ARKO,ARKO Corp. Common Stock,2000-01-01,0
ARKR,Ark Restaurants Corp. Common Stock,2000-01-01,0
ARLP,Alliance Resource Partners L.P. Common Units representing Limited Partners Interests,2000-01-01,0
ARNA,Arena Pharmaceuticals Inc. Common Stock,2000-01-01,0
AROW,Arrow Financial Corporation Common Stock,2000-01-01,0
ARPO,Aerpio Pharmaceuticals Inc. Common Stock,2000-01-01,0
ARQT,Arcutis Biotherapeutics Inc. Common Stock,2000-01-01,0
ARRW,Arrowroot Acquisition Corp. Class A common stock,2000-01-01,0
ARRWU,Arrowroot Acquisition Corp. Unit,2000-01-01,0
ARRWW,Arrowroot Acquisition Corp. Warrant,2000-01-01,0
ARRY,Array Technologies Inc. Common Stock,2000-01-01,0
ARTAU,Artisan Acquisition Corp. Units,2000-01-01,0
ARTL,Artelo Biosciences Inc. Common Stock,2000-01-01,0
ARTLW,Artelo Biosciences Inc. Warrant,2000-01-01,0
ARTNA,Artesian Resources Corporation Class A Common Stock,2000-01-01,0
ARTW,Art's-Way Manufacturing Co. Inc. Common Stock,2000-01-01,0
ARVL,Arrival Ordinary Shares,2000-01-01,0
ARVLW,Arrival Warrant,2000-01-01,0
ARVN,Arvinas Inc. Common Stock,2000-01-01,0
ARWR,Arrowhead Pharmaceuticals Inc. Common Stock,2000-01-01,0
ARYA,ARYA Sciences Acquisition Corp III Class A Ordinary Shares,2000-01-01,0
ARYD,ARYA Sciences Acquisition Corp IV Class A Odinary Shares,2000-01-01,0
ASAX,Astrea Acquisition Corp. Class A Common Stock,2000-01-01,0
ASAXU,Astrea Acquisition Corp. Unit,2000-01-01,0
ASAXW,Astrea Acquisition Corp. Warrant,2000-01-01,0
ASLE,AerSale Corporation Common Stock,2000-01-01,0
ASLEW,AerSale Corporation Warrants,2000-01-01,0
ASLN,ASLAN Pharmaceuticals Limited American Depositary Shares,2000-01-01,0
ASMB,Assembly Biosciences Inc. Common Stock,2000-01-01,0
ASML,ASML Holding N.V. New York Registry Shares,2000-01-01,0
ASND,Ascendis Pharma A/S American Depositary Shares,2000-01-01,0
ASO,Academy Sports and Outdoors Inc. Common Stock,2000-01-01,0
ASPC,Alpha Capital Acquisition Company One Class A Ordinary Share,2000-01-01,0
ASPCU,Alpha Capital Acquisition Company Unit,2000-01-01,0
ASPCW,Alpha Capital Acquisition Company Warrant,2000-01-01,0
ASPS,Altisource Portfolio Solutions S.A. Common Stock,2000-01-01,0
ASPU,Aspen Group Inc. Common Stock,2000-01-01,0
ASRT,Assertio Holdings Inc. Common Stock,2000-01-01,0
ASRV,AmeriServ Financial Inc. Common Stock,2000-01-01,0
ASRVP,AmeriServ Financial Inc. AmeriServ Financial Trust I - 8.45% Beneficial Unsecured Securities Series A,2000-01-01,0
ASTC,Astrotech Corporation (DE) Common Stock,2000-01-01,0
ASTE,Astec Industries Inc. Common Stock,2000-01-01,0
ASTS,AST SpaceMobile Inc. Class A Common Stock,2000-01-01,0
ASTSW,AST SpaceMobile Inc. Warrant,2000-01-01,0
ASUR,Asure Software Inc Common Stock,2000-01-01,0
ASYS,Amtech Systems Inc. Common Stock,2000-01-01,0
ATAX,America First Multifamily Investors L.P. Beneficial Unit Certificates (BUCs) representing Limited Partnership Interests,2000-01-01,0
ATCOL,Atlas Corp. 7.125% Notes due 2027,2000-01-01,0
ATCX,Atlas Technical Consultants Inc. Class A Common Stock,2000-01-01,0
ATEC,Alphatec Holdings Inc. Common Stock,2000-01-01,0
ATER,Aterian Inc. Common Stock,2000-01-01,0
ATEX,Anterix Inc. Common Stock,2000-01-01,0
ATHA,Athira Pharma Inc. Common Stock,2000-01-01,0
ATHE,Alterity Therapeutics Limited American Depositary Shares,2000-01-01,0
ATHX,Athersys Inc. Common Stock,2000-01-01,0
ATIF,ATIF Holdings Limited Ordinary Shares,2000-01-01,0
ATLC,Atlanticus Holdings Corporation Common Stock,2000-01-01,0
ATLO,Ames National Corporation Common Stock,2000-01-01,0
ATNF,180 Life Sciences Corp. Common Stock,2000-01-01,0
ATNFW,180 Life Sciences Corp. Warrant,2000-01-01,0
ATNI,ATN International Inc. Common Stock,2000-01-01,0
ATNX,Athenex Inc. Common Stock,2000-01-01,0
ATOM,Atomera Incorporated Common Stock,2000-01-01,0
ATOS,Atossa Therapeutics Inc. Common Stock,2000-01-01,0
ATRA,Atara Biotherapeutics Inc. Common Stock,2000-01-01,0
ATRC,AtriCure Inc. Common Stock,2000-01-01,0
ATRI,Atrion Corporation Common Stock,2000-01-01,0
ATRO,Astronics Corporation Common Stock,2000-01-01,0
ATRS,Antares Pharma Inc. Common Stock,2000-01-01,0
ATSG,Air Transport Services Group Inc,2000-01-01,0
ATSPT,Archimedes Tech SPAC Partners Co. Subunit,2000-01-01,0
ATSPU,Archimedes Tech SPAC Partners Co. Unit,2000-01-01,0
ATSPW,Archimedes Tech SPAC Partners Co. Warrant,2000-01-01,0
ATVC,Tribe Capital Growth Corp I Class A common stock,2000-01-01,0
ATVCU,Tribe Capital Growth Corp I Units,2000-01-01,0
ATVCW,Tribe Capital Growth Corp I Warrant,2000-01-01,0
ATVI,Activision Blizzard Inc. Common Stock,2000-01-01,0
ATXI,Avenue Therapeutics Inc. Common Stock,2000-01-01,0
AUB,Atlantic Union Bankshares Corporation Common Stock,2000-01-01,0
AUBAP,Atlantic Union Bankshares Corporation Depositary Shares each representing a 1/400th ownership interest in a share of 6.875% Perpetual Non-Cumulative Preferred Stock Series A,2000-01-01,0
AUBN,Auburn National Bancorporation Inc. Common Stock,2000-01-01,0
AUDC,AudioCodes Ltd. Common Stock,2000-01-01,0
AUPH,Aurinia Pharmaceuticals Inc Ordinary Shares,2000-01-01,0
AURC,Aurora Acquisition Corp. Class A Ordinary Shares,2000-01-01,0
AURCU,Aurora Acquisition Corp. Unit,2000-01-01,0
AURCW,Aurora Acquisition Corp. Warrant,2000-01-01,0
AUTL,Autolus Therapeutics plc American Depositary Share,2000-01-01,0
AUTO,AutoWeb Inc. Common Stock,2000-01-01,0
AUUD,Auddia Inc. Common Stock,2000-01-01,0
AUUDW,Auddia Inc. Warrants,2000-01-01,0
AUVI,Applied UV Inc. Common Stock,2000-01-01,0
AVAH,Aveanna Healthcare Holdings Inc. Common Stock,2000-01-01,0
AVAV,AeroVironment Inc. Common Stock,2000-01-01,0
AVCO,Avalon GloboCare Corp. Common Stock,2000-01-01,0
AVCT,American Virtual Cloud Technologies Inc. Common Stock ,2000-01-01,0
AVCTW,American Virtual Cloud Technologies Inc. Warrant expiring 4/7/2025,2000-01-01,0
AVDL,Avadel Pharmaceuticals plc American Depositary Shares,2000-01-01,0
AVEO,AVEO Pharmaceuticals Inc. Common Stock,2000-01-01,0
AVGO,Broadcom Inc. Common Stock,2000-01-01,0
AVGOP,Broadcom Inc. 8.00% Mandatory Convertible Preferred Stock Series A,2000-01-01,0
AVGR,Avinger Inc. Common Stock,2000-01-01,0
AVID,Avid Technology Inc. Common Stock,2000-01-01,0
AVIR,Atea Pharmaceuticals Inc. Common Stock,2000-01-01,0
AVNW,Aviat Networks Inc. Common Stock,2000-01-01,0
AVO,Mission Produce Inc. Common Stock,2000-01-01,0
AVRO,AVROBIO Inc. Common Stock,2000-01-01,0
AVT,Avnet Inc. Common Stock,2000-01-01,0
AVXL,Anavex Life Sciences Corp. Common Stock,2000-01-01,0
AWH,Aspira Women's Health Inc. Common Stock,2000-01-01,0
AWRE,Aware Inc. Common Stock,2000-01-01,0
AXAS,Abraxas Petroleum Corporation Common Stock,2000-01-01,0
AXDX,Accelerate Diagnostics Inc. Common Stock,2000-01-01,0
AXGN,Axogen Inc. Common Stock,2000-01-01,0
AXLA,Axcella Health Inc. Common Stock,2000-01-01,0
AXNX,Axonics Inc. Common Stock,2000-01-01,0
AXON,Axon Enterprise Inc. Common Stock,2000-01-01,0
AXSM,Axsome Therapeutics Inc. Common Stock,2000-01-01,0
AXTI,AXT Inc Common Stock,2000-01-01,0
AY,Atlantica Sustainable Infrastructure plc Ordinary Shares,2000-01-01,0
AYLA,Ayala Pharmaceuticals Inc. Common Stock,2000-01-01,0
AYRO,AYRO Inc. Common Stock,2000-01-01,0
AYTU,Aytu BioPharma Inc.  Common Stock,2000-01-01,0
AZN,AstraZeneca PLC American Depositary Shares,2000-01-01,0
